Sheet: levels
A1: ID（血统类型） | B1: 血统名称 | C1: 名称备注 | D1: 所属国家 | E1: 力量成长 | F1: 技巧成长 | G1: 敏捷成长 | H1: 体质成长 | I1: 感知成长 | J1: 意志成长 | K1: 六维成长之和 | L1: 图标 | M1: 血统描述 | N1: 血统中文描述 | O1: 血统名字颜色 | P1: 对应声望ID | Q1: 是否王族血脉 | R1: 婚戒ID
A2: uint|mID | B2: string|descent_name | C2: string|descentChineseName | D2: string|country | E2: double|strup | F2: double|dexup | G2: double|agiup | H2: double|vitup | I2: double|perup | J2: double|wilup | K2: float|6_DTotal | L2: string|descentIcon | M2: string|descentDes | N2: string|descentChineseDes | O2: string|color | P2: int|prestige | Q2: int|royalBlood | R2: int|weddingRing
A3: both | B3: client | C3: none | D3: both | E3: both | F3: both | G3: both | H3: both | I3: both | J3: both | K3: none | L3: client | M3: client | N3: none | O3: both | P3: both | Q3: both | R3: both
A4: 1 | B4: DescentName1 | C4: 荷尔沃王族 | D4: 1 | E4: 0.8 | F4: 0.8 | G4: 0.3 | H4: 0.6 | I4: 0.1 | J4: 0.1 | K4: =SUM(RC[-6]:RC[-1]) -> 2.7 | L4: DescentIcon1 | M4: DescentDes1 | N4: 荷尔沃王国缔造者的后裔，其血统最早可追溯至主神阿芙洛狄忒，身材高大，金发白肤。 | O4: 128,182,232 | P4: 1 | Q4: 1 | R4: 1000300
A5: 2 | B5: DescentName2 | C5: 索勒斯圣裔 | D5: 2 | E5: 0.5 | F5: 0.7 | G5: 0.1 | H5: 0.9 | I5: 0.1 | J5: 0.1 | K5: =SUM(RC[-6]:RC[-1]) -> 2.4 | L5: DescentIcon2 | M5: DescentDes2 | N5: 索勒斯教国缔造者的后裔，其血统最早可追溯至主神伊登，身材高大而强壮。 | O5: 128,182,232 | P5: 2 | Q5: 1 | R5: 1000301
A6: 3 | B6: DescentName3 | C6: 赫拉希诺王族 | D6: 4 | E6: 0.7 | F6: 1 | G6: 0.1 | H6: 0.3 | I6: 0.5 | J6: 0.1 | K6: =SUM(RC[-6]:RC[-1]) -> 2.7 | L6: DescentIcon3 | M6: DescentDes3 | N6: 赫拉希诺王国缔造者的后裔，其血统最早可追溯至主神杜穆兹，富有技巧与感知力。 | O6: 128,182,232 | P6: 3 | Q6: 1 | R6: 1000302
A7: 4 | B7: DescentName4 | C7: 巴拉赞王族 | D7: 5 | E7: 0.9 | F7: 0.5 | G7: 0.1 | H7: 0.7 | I7: 0.1 | J7: 0.1 | K7: =SUM(RC[-6]:RC[-1]) -> 2.4 | L7: DescentIcon4 | M7: DescentDes4 | N7: 巴拉赞王国缔造者的后裔，其血统最早可追溯至主神荷鲁斯，孔武有力，气质超群。 | O7: 128,182,232 | P7: 4 | Q7: 1 | R7: 1000303
A8: 5 | B8: DescentName5 | C8: 金尼斯暗裔 | D8: 3 | E8: 0.8 | F8: 0.3 | G8: 0.1 | H8: 1 | I8: 0.1 | J8: 0.1 | K8: =SUM(RC[-6]:RC[-1]) -> 2.4 | L8: DescentIcon5 | M8: DescentDes5 | N8: 金尼斯王国缔造者的后裔，其血统最早可追溯至主神霍德尔，身体极为强壮。 | O8: 128,182,232 | P8: 5 | Q8: 1 | R8: 1000304
A9: 6 | B9: DescentName6 | C9: 雪山遗民 | D9: 6 | E9: 0.3 | F9: 0.9 | G9: 0.7 | H9: 0.1 | I9: 0.4 | J9: 0.1 | K9: =SUM(RC[-6]:RC[-1]) -> 2.5 | L9: DescentIcon6 | M9: DescentDes6 | N9: 较为纯正的弗瑞莫德原住民，其血统最早可追溯至主神普罗米修斯，心灵手巧，向往自然。 | O9: 128,182,232 | P9: 6 | Q9: 1 | R9: 1000305
A10: 7 | B10: DescentName7 | C10: 弗瑞莫德精灵 | D10: 6 | E10: 0.1 | F10: 0.3 | G10: 0.5 | H10: 0.1 | I10: 1 | J10: 0.7 | K10: =SUM(RC[-6]:RC[-1]) -> 2.7 | L10: DescentIcon7 | M10: DescentDes7 | N10: 传说中的上古生物，行迹极其罕见，寿命极长，来自雪山深处，非常神秘。 | O10: 128,182,232 | P10: 6 | Q10: 1 | R10: 1000306
A11: 8 | B11: DescentName8 | C11: 沃尔加德贵族 | D11: 1 | E11: 1 | F11: 0.1 | G11: 0.7 | H11: 0.5 | I11: 0.1 | J11: 0.3 | K11: =SUM(RC[-6]:RC[-1]) -> 2.7 | L11: DescentIcon8 | M11: DescentDes8 | N11: 传说中狼神哈提的血脉，力大无穷，嗜血残暴，崇尚武力与掠夺。 | O11: 128,182,232 | P11: 8 | Q11: 1 | R11: 1000307
A12: 9 | B12: DescentName9 | C12: 欧塔鲁特贵族 | D12: 5 | E12: 0.1 | F12: 0.5 | G12: 1 | H12: 0.6 | I12: 0.1 | J12: 0.1 | K12: =SUM(RC[-6]:RC[-1]) -> 2.4 | L12: DescentIcon9 | M12: DescentDes9 | N12: 欧塔鲁特王国的流放统治者后裔，身体机能发达，爆发力强。 | O12: 128,182,232 | P12: 50 | Q12: 1 | R12: 1000308
A13: 10 | B13: DescentName10 | C13: 科尼托后裔 | D13: 2 | E13: 0.1 | F13: 0.6 | G13: 0.1 | H13: 0.3 | I13: 0.6 | J13: 0.8 | K13: =SUM(RC[-6]:RC[-1]) -> 2.5 | L13: DescentIcon10 | M13: DescentDes10 | N13: 科尼托流落统治者血脉，后出现在中央大陆，有传闻掌握着失传的炼金术。 | O13: 128,182,232 | P13: 50 | Q13: 1 | R13: 1000309
A14: 11 | B14: DescentName11 | C14: 艾德勒斯遗民 | D14: 3 | E14: 0.6 | F14: 0.1 | G14: 0.1 | H14: 0.8 | I14: 0.1 | J14: 1 | K14: =SUM(RC[-6]:RC[-1]) -> 2.7 | L14: DescentIcon11 | M14: DescentDes11 | N14: 艾德勒斯一支神秘家族后人，地位尊贵，力量充沛，意志坚定。 | O14: 128,182,232 | P14: 11 | Q14: 1 | R14: 1000310
A15: 12 | B15: DescentName12 | C15: 埃非勒姆 | D15: 4 | E15: 0.6 | F15: 0.1 | G15: 0.9 | H15: 0.6 | I15: 0.1 | J15: 0.1 | K15: =SUM(RC[-6]:RC[-1]) -> 2.4 | L15: DescentIcon12 | M15: DescentDes12 | N15: 中央大陆东部埃非勒姆的贵族阶层，天生的骑手，草原的王者。 | O15: 128,182,232 | P15: 50 | Q15: 1 | R15: 1000311
A16: 13 | B16: DescentName13 | C16: 日出之子 | D16: 1,5 | E16: 0.5 | F16: 0.8 | G16: 0.9 | H16: 0.1 | I16: 0.3 | J16: 0.1 | K16: =SUM(RC[-6]:RC[-1]) -> 2.7 | L16: DescentIcon13 | M16: DescentDes13 | N16: 中央大陆远东的日出之子，足智多谋，动作敏锐，飘逸脱俗，富有礼仪。 | O16: 128,182,232 | P16: 50 | Q16: 1 | R16: 1000312
A17: 14 | B17: DescentName14 | C17: 科尼托平民 | D17: 2 | E17: 0.15 | F17: 0.2 | G17: 0.1 | H17: 0.1 | I17: 0.15 | J17: 0.1 | K17: =SUM(RC[-6]:RC[-1]) -> 0.8 | L17: DescentIcon14 | M17: DescentDes14 | N17: 中央大陆原住民，巧手伶俐，信奉神秘的自然之力。 | O17: 216,221,236 | P17: 0 | Q17: 0 | R17: 1000313
A18: 15 | B18: DescentName15 | C18: 沃尔加德平民 | D18: 1 | E18: 0.2 | F18: 0.1 | G18: 0.15 | H18: 0.15 | I18: 0.1 | J18: 0.1 | K18: =SUM(RC[-6]:RC[-1]) -> 0.8 | L18: DescentIcon15 | M18: DescentDes15 | N18: 狼族人，力量十足，身材强壮，极为耐寒。 | O18: 216,221,236 | P18: 0 | Q18: 0 | R18: 1000314
A19: 16 | B19: DescentName16 | C19: 艾德勒人 | D19: 3 | E19: 0.15 | F19: 0.1 | G19: 0.1 | H19: 0.15 | I19: 0.1 | J19: 0.2 | K19: =SUM(RC[-6]:RC[-1]) -> 0.8 | L19: DescentIcon16 | M19: DescentDes16 | N19: 艾德勒人，身材适中，知识水平较高，文化丰富。 | O19: 216,221,236 | P19: 0 | Q19: 0 | R19: 1000315
A20: 17 | B20: DescentName17 | C20: 埃非勒多人 | D20: 4 | E20: 0.15 | F20: 0.1 | G20: 0.2 | H20: 0.15 | I20: 0.1 | J20: 0.1 | K20: =SUM(RC[-6]:RC[-1]) -> 0.8 | L20: DescentIcon17 | M20: DescentDes17 | N20: 中央大陆大陆东部的游牧民族，埃非勒姆的主要组成民族，性情豪爽奔放。 | O20: 216,221,236 | P20: 0 | Q20: 0 | R20: 1000316
A21: 18 | B21: DescentName18 | C21: 普瑞帕恩人 | D21: 1,2,3,4,5,6 | E21: 0.15 | F21: 0.15 | G21: 0.1 | H21: 0.2 | I21: 0.1 | J21: 0.1 | K21: =SUM(RC[-6]:RC[-1]) -> 0.8 | L21: DescentIcon18 | M21: DescentDes18 | N21: 迁入中央大陆后，强壮尚武的普瑞帕恩人最终成为了这片大陆人口最多的居民。 | O21: 216,221,236 | P21: 0 | Q21: 0 | R21: 1000317
A22: 19 | B22: DescentName19 | C22: 欧塔鲁特平民 | D22: 5 | E22: 0.1 | F22: 0.15 | G22: 0.2 | H22: 0.15 | I22: 0.1 | J22: 0.1 | K22: =SUM(RC[-6]:RC[-1]) -> 0.8 | L22: DescentIcon19 | M22: DescentDes19 | N22: 肤色黝黑，耐力超群的民族，他们惊人的爆发力非常适合某些职业。 | O22: 216,221,236 | P22: 0 | Q22: 0 | R22: 1000318